{
  "confidence": "PROCESS",
  "endpoint_lease_sha256": "sha256:b1fd1745a35b0c688a9532c96317ada96f9db359bf35f5a25eae1e97ddb500c8",
  "event_id": "local-event:0e8952b1ff8783c50880568e",
  "event_type": "RUNTIME_ENDPOINT_EXITED",
  "liveness": "DEAD",
  "observation": {
    "cancelled": false,
    "returncode": 0,
    "timed_out": false
  },
  "observed_at": "2026-09-15T22:20:39.831102+00:00",
  "run_id": "project-memory-dream-fixture",
  "schema": "tau.runtime_event.v1",
  "source": "local",
  "state": "EXITED"
}
