{
  "confidence": "PROCESS",
  "endpoint_lease_sha256": "sha256:b7a347f51e298231323565f0363a1dc7a8915f410660ae909fb3d37cf515194e",
  "event_id": "local-event:56b7257bfbe2df336b6989b7",
  "event_type": "RUNTIME_ENDPOINT_EXITED",
  "liveness": "DEAD",
  "observation": {
    "cancelled": false,
    "returncode": 0,
    "timed_out": false
  },
  "observed_at": "2026-09-15T22:20:38.243471+00:00",
  "run_id": "project-memory-dream-fixture",
  "schema": "tau.runtime_event.v1",
  "source": "local",
  "state": "EXITED"
}
